{
  "artifactKind": "aleph_bench_kaggle_raw_capture",
  "callPlanIdentity": {
    "fullShardPlanSha256": "fb2b01bd9984ddc830322baa2aeeb1f0c3ee006a41a641241bd5eaaed9dc7fd7",
    "id": "aleph-bench-v0.2-frozen-call-plan",
    "rerunsPerPrompt": 5,
    "sha256": "c8761e280e089da4eed5871b9efad770284be9178bb6a4253d81cb43e873f6ec",
    "totalPlannedCallCount": 900
  },
  "calls": {
    "activeCall": null,
    "attemptedCallCount": 6,
    "failedCallCount": 0,
    "missingOutputCount": 0,
    "nonStringOutputCount": 0,
    "oversizedOutputCount": 0,
    "plannedCallCount": 6,
    "returnedStringCount": 6,
    "terminalCallCount": 6
  },
  "canonicalReplayEligible": true,
  "captureComplete": true,
  "captureSchemaVersion": "1.1.0",
  "datasetIdentity": {
    "hashAlgorithm": "sha256-length-framed-filename-and-content-v1",
    "id": "aleph-bench-v0.2-public-s2",
    "itemCount": 30,
    "sha256": "6f3a03400ec16405414afb94c7c639f2df07f7f0797c3b58ad1c4229e52f2041"
  },
  "diagnostics": {
    "activeCallRowId": null,
    "coverageComplete": true,
    "lifecycleFailureRowIds": [],
    "missingFinishReasonRowIds": [],
    "missingOutputRowIds": [],
    "missingPlannedRowIds": [],
    "missingUsageRowIds": [],
    "nearCapOutputRowIds": [],
    "nonStringOutputRowIds": [],
    "oversizedOutputRowIds": [],
    "replayBlockedReasons": [],
    "scoringTextTooLongRowIds": [],
    "terminalFailureRowIds": [],
    "tokenLimitTerminationRowIds": [],
    "unpairedSurrogateRowIds": [],
    "unsupportedFinishReasonRowIds": [],
    "zeroUsageRowIds": []
  },
  "endedAt": "2026-09-22T00:00:50Z",
  "id": "aleph-bench-kaggle-capture-v1-artifact-cc541dcc2da1a927a8b850c5c3d430a341cd260d4ae9ebe09fbea051d409f0f2",
  "leaderboardEligible": false,
  "modelObservation": {
    "canonicalModelId": null,
    "mappingStatus": "unmapped",
    "platform": "kaggle",
    "providerRevision": null,
    "pythonType": "kaggle_benchmarks.actors.proxy_openai.OpenAI",
    "slug": "google/gemini-2.5-flash"
  },
  "packageIdentity": {
    "bytes": 3427,
    "id": "aleph-bench-v0.2-scorer-conformance",
    "manifestPath": "package-manifest.json",
    "sha256": "7a7aad7ae4f3fcc0bebb23cb3f3d11abe842385cc8b94e9c56a806c3c7d6089d"
  },
  "publicationEligible": false,
  "requestPolicy": {
    "conversationIsolation": "oneNamedChatPerPromptAndRerun",
    "maxAttemptsPerCall": 1,
    "maxOutputTokens": 2048,
    "nearCapMarginTokens": 32,
    "reasoning": null,
    "seed": 0,
    "temperature": 0,
    "transportRetries": 0
  },
  "rows": [
    {
      "capturedAt": "2026-09-22T00:00:07Z",
      "conversationName": "aleph-capture-s2-001-s2-001-r1-p0-rerun-0",
      "dispatchStarted": true,
      "itemId": "s2-001",
      "lifecycleFailure": null,
      "observedOutputType": "string",
      "outcome": "returnedString",
      "promptCodePointCount": 184,
      "promptId": "s2-001-r1-p0",
      "promptText": "Create S2-001 arithmetic card. Use start 6, step 3, three rows. For row r, print n=start+(r-1)*step, n+step, n*step, and the glyph sequence blue, copper, jade. End with checksum A-195.",
      "promptUtf8Sha256": "ff865924eb8d5566402183c70d98ffa01157bb025b2d3d3f158de4b68ec44713",
      "rawOutput": "output-0",
      "rawOutputCodePointCount": 8,
      "rawOutputStringSha256": "76e3452fc339a07d3352486cc3d371a344f84200b666158de8258da3320ed09d",
      "rerunIndex": 0,
      "rowId": "s2-001:s2-001-r1-p0:rerun-0",
      "terminalFailure": null,
      "usage": {
        "backendLatencyMs": 50,
        "finishReason": "stop",
        "inputCostNanodollars": "1000",
        "inputTokens": 20,
        "outputCostNanodollars": "2000",
        "outputTokens": 100
      }
    },
    {
      "capturedAt": "2026-09-22T00:00:15Z",
      "conversationName": "aleph-capture-s2-001-s2-001-r1-p1-rerun-0",
      "dispatchStarted": true,
      "itemId": "s2-001",
      "lifecycleFailure": null,
      "observedOutputType": "string",
      "outcome": "returnedString",
      "promptCodePointCount": 189,
      "promptId": "s2-001-r1-p1",
      "promptText": "Render an arithmetic card named S2-001 arithmetic card: three numbered rows from start 6 with step 3; include fields n, n+step, n*step, glyph using blue, copper, jade; final checksum A-195.",
      "promptUtf8Sha256": "e9a9f179d95375e8c5afb9f17b5702c2920c1131d162ddb1407fa66b6f912b4e",
      "rawOutput": "output-1",
      "rawOutputCodePointCount": 8,
      "rawOutputStringSha256": "abe5555eda8ee434a8067b4ba26374870493b40bfca18c437a9428bdd2dab4a8",
      "rerunIndex": 0,
      "rowId": "s2-001:s2-001-r1-p1:rerun-0",
      "terminalFailure": null,
      "usage": {
        "backendLatencyMs": 50,
        "finishReason": "stop",
        "inputCostNanodollars": "1000",
        "inputTokens": 20,
        "outputCostNanodollars": "2000",
        "outputTokens": 100
      }
    },
    {
      "capturedAt": "2026-09-22T00:00:23Z",
      "conversationName": "aleph-capture-s2-002-s2-002-r1-p0-rerun-0",
      "dispatchStarted": true,
      "itemId": "s2-002",
      "lifecycleFailure": null,
      "observedOutputType": "string",
      "outcome": "returnedString",
      "promptCodePointCount": 321,
      "promptId": "s2-002-r1-p0",
      "promptText": "Create S2-002 letter lattice. Four lettered lines A-D use names Aster, Beryl, Cato, Dessa. For each line write '<letter>. <name> <verb> the <color> <noun> at <number>.' Use values Aster:copper:cipher:clicks:24; Beryl:jade:delta:drifts:33; Cato:violet:ember:echoes:42; Dessa:silver:fable:folds:51. End with checksum L-108.",
      "promptUtf8Sha256": "7c408ea13ebc21d08508f979137f2d2d9d5be8a52882a840aba92a97badfd8a8",
      "rawOutput": "output-2",
      "rawOutputCodePointCount": 8,
      "rawOutputStringSha256": "2e1dc1d4e9850fd488459de45e91420bb1fe2b2e6b76a2c0c5340c6b9a6e440c",
      "rerunIndex": 0,
      "rowId": "s2-002:s2-002-r1-p0:rerun-0",
      "terminalFailure": null,
      "usage": {
        "backendLatencyMs": 50,
        "finishReason": "stop",
        "inputCostNanodollars": "1000",
        "inputTokens": 20,
        "outputCostNanodollars": "2000",
        "outputTokens": 100
      }
    },
    {
      "capturedAt": "2026-09-22T00:00:31Z",
      "conversationName": "aleph-capture-s2-002-s2-002-r1-p1-rerun-0",
      "dispatchStarted": true,
      "itemId": "s2-002",
      "lifecycleFailure": null,
      "observedOutputType": "string",
      "outcome": "returnedString",
      "promptCodePointCount": 255,
      "promptId": "s2-002-r1-p1",
      "promptText": "Render a letter lattice titled S2-002 letter lattice: A-D lines with the fixed name/color/noun/verb/number tuples Aster:copper:cipher:clicks:24; Beryl:jade:delta:drifts:33; Cato:violet:ember:echoes:42; Dessa:silver:fable:folds:51 and final checksum L-108.",
      "promptUtf8Sha256": "375010796c2a832806f4454c302539362e8571a19de0244c3a8ea2908dba365e",
      "rawOutput": "output-3",
      "rawOutputCodePointCount": 8,
      "rawOutputStringSha256": "6a894240c8d6e2ec86bc29aa729b50cebda27059187963567a43e6333e4e221b",
      "rerunIndex": 0,
      "rowId": "s2-002:s2-002-r1-p1:rerun-0",
      "terminalFailure": null,
      "usage": {
        "backendLatencyMs": 50,
        "finishReason": "stop",
        "inputCostNanodollars": "1000",
        "inputTokens": 20,
        "outputCostNanodollars": "2000",
        "outputTokens": 100
      }
    },
    {
      "capturedAt": "2026-09-22T00:00:39Z",
      "conversationName": "aleph-capture-s2-003-s2-003-r1-p0-rerun-0",
      "dispatchStarted": true,
      "itemId": "s2-003",
      "lifecycleFailure": null,
      "observedOutputType": "string",
      "outcome": "returnedString",
      "promptCodePointCount": 204,
      "promptId": "s2-003-r1-p0",
      "promptText": "Create S2-003 route receipt. Print four legs as 'leg i: go direction for distance; mark=mark'. Use leg triples west:14:Q5; north:7:T8; east:13:N4; south:6:V6. Then print total 40, parity even, code R-775.",
      "promptUtf8Sha256": "abd8ed7c3daab75256082f8e63b0d9e598ae86085e784dc88f298a484763262b",
      "rawOutput": "output-4",
      "rawOutputCodePointCount": 8,
      "rawOutputStringSha256": "ec5f316e46ea28fc401a056c8491895ffed401a8e980dde61973167444c8c7d7",
      "rerunIndex": 0,
      "rowId": "s2-003:s2-003-r1-p0:rerun-0",
      "terminalFailure": null,
      "usage": {
        "backendLatencyMs": 50,
        "finishReason": "stop",
        "inputCostNanodollars": "1000",
        "inputTokens": 20,
        "outputCostNanodollars": "2000",
        "outputTokens": 100
      }
    },
    {
      "capturedAt": "2026-09-22T00:00:47Z",
      "conversationName": "aleph-capture-s2-003-s2-003-r1-p1-rerun-0",
      "dispatchStarted": true,
      "itemId": "s2-003",
      "lifecycleFailure": null,
      "observedOutputType": "string",
      "outcome": "returnedString",
      "promptCodePointCount": 172,
      "promptId": "s2-003-r1-p1",
      "promptText": "Render a route receipt named S2-003 route receipt; four legs from triples west:14:Q5; north:7:T8; east:13:N4; south:6:V6; finish with total 40, parity even, and code R-775.",
      "promptUtf8Sha256": "7db2347fdb61a035ad26735b1da61b38a88991a5aead71fbc658401d5985d7b8",
      "rawOutput": "output-5",
      "rawOutputCodePointCount": 8,
      "rawOutputStringSha256": "817a5d5c80c7b0edb1600e7d4d47ab5384b27f9422836ffe5e21e49745525143",
      "rerunIndex": 0,
      "rowId": "s2-003:s2-003-r1-p1:rerun-0",
      "terminalFailure": null,
      "usage": {
        "backendLatencyMs": 50,
        "finishReason": "stop",
        "inputCostNanodollars": "1000",
        "inputTokens": 20,
        "outputCostNanodollars": "2000",
        "outputTokens": 100
      }
    }
  ],
  "runtimeObservation": {
    "platform": "Linux-x86_64",
    "pythonFullVersion": "3.13.2",
    "pythonVersion": "3.13",
    "unicodeDatabaseVersion": "15.1.0"
  },
  "shard": {
    "coverageSha256": "2e16bf9db5e67f059f7b42475e0f4df2b140a151354e120f07b2fe671691c2c0",